{
  "public_contract_version": "0.1",
  "ontology_version": "0.1",
  "model": {
    "id": "model.compatibility",
    "physics": [],
    "mathematical": [],
    "constitutive": [],
    "spatial": [],
    "scopes": [],
    "material": [],
    "conditions": [],
    "numerical": [],
    "observations": []
  },
  "tasks": [],
  "relations": []
}
